symbol,name
LIGS.DE,Amundi STOXX Europe 600 Industrials UCITS ETF Acc
XQUI.DE,Xtrackers Portfolio UCITS ETF 1C
EL4A.DE,Deka DAX UCITS ETF
UIM6.DE,UBS MSCI USA UCITS ETF USD dis
H4ZU.DE,HSBC MSCI Taiwan Capped UCITS ETF
C001.DE,Amundi Index - Amundi Dax UCITS
EXS1.DE,iShares Core DAX UCITS ETF (DE) EUR (Acc)
CG1G.DE,Amundi ETF DAX UCITS ETF DR
QDVB.DE,iShares Edge MSCI USA Quality Factor UCITS ETF USD (Acc)
AYE2.DE,iShares € High Yield Corp Bond ESG SRI UCITS ETF EUR (Acc)
D6RQ.DE,Deka MSCI USA Climate Change ESG CTB UCITS ETF
EXI3.DE,iShares Dow Jones Industrial Average UCITS ETF (DE)
XDWS.DE,Xtrackers MSCI World Consumer Staples UCITS ETF 1C
6PSK.DE,Invesco FTSE RAFI Emerging Markets UCITS ETF
FEUQ.DE,Fidelity Europe Quality Income UCITS ETF EUR Acc
VOOM.DE,Amundi Global Gender Equality ETF Accumulation
WTIZ.DE,WisdomTree Japan Equity UCITS ETF - USD Acc
QDVI.DE,iShares Edge MSCI USA Value Factor UCITS ETF USD (Acc)
IUSF.DE,iShares MSCI USA Islamic UCITS ETF
GGUE.DE,UBS Global Gender Equality UCITS ETF hEUR acc
DX2G.DE,Xtrackers CAC 40 UCITS ETF
EL4Z.DE,Deka MSCI USA UCITS ETF
XDWY.DE,Xtrackers MSCI World Screened UCITS ETF 1D
IBCK.DE,iShares Edge S&P 500 Minimum Volatility UCITS ETF USD (Acc)
SYBJ.DE,SPDR Bloomberg Euro High Yield Bond UCITS ETF
FEUI.DE,Fidelity Europe Quality Income UCITS ETF EUR Inc
D500.DE,Invesco S&P 500 UCITS ETF (Dist)
SPP1.DE,SPDR MSCI All Country World EUR Hdg UCITS ETF (Acc)
XMVE.DE,Xtrackers MSCI EMU Screened UCITS ETF 1D
GC40.DE,Amundi Index Solutions - AMUNDI CAC 40 ESG UCITS ETF DR - EUR (C)
IS38.DE,** SEE<IUSE.DE>
H4ZD.DE,HSBC MSCI USA QUALITY UCITS ETF
LDAX.DE,Amundi DAX II UCITS ETF Dist
ZPRX.DE,SPDR MSCI Europe Small Cap Value Weighted UCITS ETF EUR Acc
LGQM.DE,Amundi Pan Africa UCITS ETF Acc
IS3K.DE,iShares $ Short Duration High Yield Corp Bond UCITS ETF
LYY7.DE,Amundi DAX III UCITS ETF
ENOA.DE,BNP Paribas Easy MSCI USA Min TE UCITS ETF Cap
B500.DE,Amundi Index Solutions - Amundi S&P 500 Buyback
DELG.DE,L&G US ESG Exclusions Paris Aligned UCITS ETF
WEBI.DE,Amundi Core MSCI USA UCITS ETF Dist
GACA.DE,Goldman Sachs ActiveBeta Paris-Aligned Sustainable US Large Cap Equity UCITS ETF USD Acc
